{
  "meta": {
    "version": "1.2",
    "schema_version": "1.2",
    "date": "2026-05-15",
    "author": "Becze Szabolcs / Exar Labs",
    "description": "Deák Húsmíves termékkatalógus — 46 termék, 6 kategória, 15 termék VG-opcióval (DH-173). Generated from MASTER/products/*.md + _options.yaml."
  },
  "categories": [
    {
      "category_id": "friss_serteshus",
      "category_name_hu": "Friss Sertéshús",
      "category_name_ro": "Carne proaspătă de porc"
    },
    {
      "category_id": "friss_novendekhus",
      "category_name_hu": "Friss Növendékhús",
      "category_name_ro": "Carne proaspătă de vițel"
    },
    {
      "category_id": "friss_csirkehus",
      "category_name_hu": "Friss Csirkehús",
      "category_name_ro": "Carne proaspătă de pui"
    },
    {
      "category_id": "fustolt_aruk",
      "category_name_hu": "Füstölt Áruk",
      "category_name_ro": "Produse afumate"
    },
    {
      "category_id": "kolbasz_szalami",
      "category_name_hu": "Kolbász & Szalámi",
      "category_name_ro": "Cârnați & Salam"
    },
    {
      "category_id": "felvagott_egyeb",
      "category_name_hu": "Felvágott & Egyéb",
      "category_name_ro": "Mezeluri & Altele"
    }
  ],
  "products": [
    {
      "id": "abalt_szalonna",
      "category": "felvagott_egyeb",
      "image": "abalt_szalonna.webp",
      "product_type": "weight",
      "unit": "kg",
      "price": 35.0,
      "is_available": true,
      "popularity_score": 100,
      "internal_code": "941",
      "product_name_hu": "Abált Szalonna",
      "product_name_ro": "Slănină fiartă",
      "description_hu": "Főtt szalonna, fokhagymával és fűszerekkel ízesítve, hidegen szeletelve tálalható.",
      "description_ro": "Slănină fiartă, condimentată cu usturoi și mirodenii, servită feliată rece.",
      "estimated_weight_per_piece": null,
      "weight_range_min": null,
      "weight_range_max": null,
      "quantity_override": null,
      "note_hu": null,
      "note_ro": null,
      "options": []
    },
    {
      "id": "cerna_kolbasz",
      "category": "kolbasz_szalami",
      "image": "cerna_kolbasz.webp",
      "product_type": "weight",
      "unit": "kg",
      "price": 48.0,
      "is_available": true,
      "popularity_score": 100,
      "internal_code": "920",
      "product_name_hu": "Cérna Kolbász",
      "product_name_ro": "Cârnați Cabanos",
      "description_hu": "Vékony, spárgával kötött kolbász, fűszeres ízvilággal, sütve és főzve egyaránt kitűnő.",
      "description_ro": "Cârnat subțire legat cu sfoară, cu aromă picantă, excelent prăjit și fiert.",
      "estimated_weight_per_piece": null,
      "weight_range_min": null,
      "weight_range_max": null,
      "quantity_override": null,
      "note_hu": null,
      "note_ro": null,
      "options": []
    },
    {
      "id": "csirke_egybe_comb",
      "category": "friss_csirkehus",
      "image": "csirke_egybe_comb.webp",
      "product_type": "weight",
      "unit": "kg",
      "price": 17.0,
      "is_available": true,
      "popularity_score": 100,
      "internal_code": "ACS02",
      "product_name_hu": "Csirke Egybe Comb",
      "product_name_ro": "Pulpă de pui întreagă",
      "description_hu": "Friss csirke comb egészben (alsó+felső). Lerbe sütésre, grillezésre, pörköltnek ideális.",
      "description_ro": "Pulpă de pui întreagă (sus+jos). Ideală pentru cuptor, grătar sau tocane.",
      "estimated_weight_per_piece": null,
      "weight_range_min": null,
      "weight_range_max": null,
      "quantity_override": null,
      "note_hu": null,
      "note_ro": null,
      "options": []
    },
    {
      "id": "csirke_mell_csont_borr_nelkul",
      "category": "friss_csirkehus",
      "image": "csirke_mell.webp",
      "product_type": "weight",
      "unit": "kg",
      "price": 34.0,
      "is_available": true,
      "popularity_score": 100,
      "internal_code": "ACS04",
      "product_name_hu": "Csirke Mell Csont és Bőr Nélkül",
      "product_name_ro": "Piept de pui fără os și piele",
      "description_hu": "Friss csirke mellfilé csontnélkül és bőr nélkül. Sütéshez, főzéshez, grillezéshez.",
      "description_ro": "Piept de pui dezosat și fără piele. Pentru prăjit, fiert sau pe grătar.",
      "estimated_weight_per_piece": null,
      "weight_range_min": null,
      "weight_range_max": null,
      "quantity_override": null,
      "note_hu": null,
      "note_ro": null,
      "options": []
    },
    {
      "id": "csirke_szarny",
      "category": "friss_csirkehus",
      "image": "csirke_szarny.webp",
      "product_type": "weight",
      "unit": "kg",
      "price": 16.0,
      "is_available": true,
      "popularity_score": 100,
      "internal_code": "ACS01",
      "product_name_hu": "Csirke Szárny",
      "product_name_ro": "Aripi de pui",
      "description_hu": "Friss csirke szárny, grillezésre, sütésre, levesbe egyaránt alkalmas.",
      "description_ro": "Aripi de pui proaspete, potrivite pentru grătar, prăjit sau supă.",
      "estimated_weight_per_piece": null,
      "weight_range_min": null,
      "weight_range_max": null,
      "quantity_override": null,
      "note_hu": null,
      "note_ro": null,
      "options": []
    },
    {
      "id": "diszno_fosajt",
      "category": "felvagott_egyeb",
      "image": "diszno_fosajt.webp",
      "product_type": "weight",
      "unit": "kg",
      "price": 35.0,
      "is_available": true,
      "popularity_score": 100,
      "internal_code": "909",
      "product_name_hu": "Disznó Fősajt",
      "product_name_ro": "Tobă de porc",
      "description_hu": "Hagyományos disznófősajt, kocsonyás állagú, fűszerekkel gazdagítva, hideg tálakra ideális.",
      "description_ro": "Tobă tradițională de porc, cu textură gelatinoasă, îmbogățită cu condimente, ideală pentru platouri reci.",
      "estimated_weight_per_piece": null,
      "weight_range_min": null,
      "weight_range_max": null,
      "quantity_override": null,
      "note_hu": null,
      "note_ro": null,
      "options": []
    },
    {
      "id": "erdelyi_kolbasz",
      "category": "kolbasz_szalami",
      "image": "erdelyi_kolbasz.webp",
      "product_type": "weight",
      "unit": "kg",
      "price": 45.0,
      "is_available": true,
      "popularity_score": 100,
      "internal_code": "911",
      "product_name_hu": "Deák háziKolbász",
      "product_name_ro": "Cârnați de casă Deák",
      "description_hu": "Hagyományos erdélyi recept szerinti fokhagymás-paprikás kolbász, füstölt aromával.",
      "description_ro": "Cârnat ardelenesc tradițional cu usturoi și boia, cu aromă afumată.",
      "estimated_weight_per_piece": null,
      "weight_range_min": null,
      "weight_range_max": null,
      "quantity_override": null,
      "note_hu": null,
      "note_ro": null,
      "options": []
    },
    {
      "id": "fustolt_belszin",
      "category": "fustolt_aruk",
      "image": "fustolt_belszin.webp",
      "product_type": "hybrid",
      "unit": "kg",
      "price": 55.0,
      "estimated_weight_per_piece": 0.4,
      "weight_range_min": 0.3,
      "weight_range_max": 0.5,
      "is_available": true,
      "popularity_score": 100,
      "internal_code": "949.3",
      "product_name_hu": "Füstölt Bélszín",
      "product_name_ro": "Mușchuleți porc afumat",
      "description_hu": "Hagyományos hideg füstöléssel készített bélszín, mélyen füstös ízzel, vékonyra szeletelve.",
      "description_ro": "Mușchi preparat prin afumare la rece tradițională, cu aromă adâncă de fum, feliat subțire.",
      "note_hu": "Darab — kb. 0.3-0.5 kg",
      "note_ro": "Bucată — aprox. 0.3-0.5 kg",
      "quantity_override": null,
      "options": []
    },
    {
      "id": "fustolt_bordacsont",
      "category": "fustolt_aruk",
      "image": "fustolt_bordacsont.webp",
      "product_type": "weight",
      "unit": "kg",
      "price": 16.0,
      "is_available": true,
      "popularity_score": 100,
      "internal_code": "953",
      "product_name_hu": "Füstölt Bordacsont",
      "product_name_ro": "Coaste porc afumat",
      "description_hu": "Füstölt bordacsont, bablevesbe és káposztás fogásokhoz nélkülözhetetlen alapanyag.",
      "description_ro": "Coaste afumate, ingredient esențial în fasole bătută și mâncăruri cu varză.",
      "estimated_weight_per_piece": null,
      "weight_range_min": null,
      "weight_range_max": null,
      "quantity_override": null,
      "note_hu": null,
      "note_ro": null,
      "options": []
    },
    {
      "id": "fustolt_csulok",
      "category": "fustolt_aruk",
      "image": "fustolt_csulok.webp",
      "product_type": "hybrid",
      "unit": "kg",
      "price": 34.0,
      "estimated_weight_per_piece": 1.5,
      "weight_range_min": 1.2,
      "weight_range_max": 1.8,
      "is_available": true,
      "popularity_score": 100,
      "internal_code": "945",
      "product_name_hu": "Füstölt Csülök",
      "product_name_ro": "Ciolan porc afumat",
      "description_hu": "Csontján füstölt csülök, mélyen átitatott füstös ízzel, főzve vagy sütve omlós.",
      "description_ro": "Ciolan afumat pe os, cu aromă profundă de fum, fraged la fiert sau la cuptor.",
      "note_hu": "Darab — kb. 1.5 kg",
      "note_ro": "Bucată — aprox. 1.5 kg",
      "quantity_override": null,
      "options": [
        {
          "option_id": "meret",
          "option_name_hu": "Méret",
          "option_name_ro": "Mărime",
          "option_type": "single_select",
          "kind": "mandatory",
          "default_value": "kozepes",
          "vg_off_hint_hu": null,
          "vg_off_hint_ro": null,
          "display_order": 10,
          "values": [
            {
              "value_id": "kisebb",
              "value_label_hu": "Kisebb",
              "value_label_ro": "Mai mic",
              "meta_hint_hu": "1,2-1,5 kg",
              "meta_hint_ro": "1,2-1,5 kg",
              "image_url": null,
              "image_alt_hu": "Kisebb csülök referenciával méretarányhoz",
              "image_alt_ro": "Ciolan mai mic cu referință de scară",